{
  "algorithm": "shared_dqn",
  "artifact_version": 1,
  "weights": {
    "w1": [
      [
        -0.02485448122024536,
        0.013270169496536255,
        0.12480716407299042,
        -0.14216619729995728,
        -0.17789991199970245,
        0.018669962882995605,
        -0.044414177536964417,
        0.01748451590538025,
        -0.011989682912826538,
        -0.18249911069869995,
        -0.18090073764324188,
        -0.050485894083976746,
        -0.11136716604232788,
        -0.11631640046834946,
        -0.05505429208278656,
        -0.10660526901483536,
        -0.18894226849079132,
        -0.13585366308689117,
        0.03790348768234253,
        0.024861127138137817,
        -0.15311530232429504,
        -0.15233761072158813,
        -0.04859215021133423,
        -0.1788361668586731,
        -0.11536277085542679,
        0.10740898549556732,
        0.032646551728248596,
        -0.12420497834682465
      ],
      [
        0.2980804741382599,
        0.5785186290740967,
        0.23068785667419434,
        0.5532850027084351,
        0.27096813917160034,
        0.3339863419532776,
        0.48910921812057495,
        0.37666988372802734,
        0.5868178606033325,
        0.5863553881645203,
        0.4233243465423584,
        0.3830903172492981,
        0.2852703332901001,
        0.29179617762565613,
        0.4297715723514557,
        0.24805092811584473,
        0.3366144299507141,
        0.5106022357940674,
        0.5294466614723206,
        -0.10472743213176727,
        -0.13908998668193817,
        0.32298997044563293,
        0.3933580219745636,
        0.5572271347045898,
        0.4254048466682434,
        0.2901232838630676,
        0.2400778979063034,
        0.37954041361808777
      ],
      [
        0.5441787242889404,
        0.3005118668079376,
        0.5130138397216797,
        0.29029184579849243,
        0.48272576928138733,
        0.20021337270736694,
        0.4144720733165741,
        0.15497031807899475,
        0.42245879769325256,
        0.31587281823158264,
        0.26389259099960327,
        0.3332903981208801,
        0.37214401364326477,
        0.23458701372146606,
        0.3862563371658325,
        0.34845197200775146,
        0.2659633159637451,
        0.16539306938648224,
        0.2837311327457428,
        -0.1476089358329773,
        0.1583641916513443,
        0.3271929621696472,
        0.17298680543899536,
        0.17154525220394135,
        0.1974189579486847,
        0.49509936571121216,
        0.31157076358795166,
        0.43441563844680786
      ],
      [
        0.6592110395431519,
        0.4625541865825653,
        0.5113283395767212,
        0.5869337916374207,
        0.16058257222175598,
        0.4119102954864502,
        0.23903603851795197,
        0.2707803249359131,
        0.42347028851509094,
        0.5650047063827515,
        0.40291398763656616,
        0.47530511021614075,
        0.5278159976005554,
        0.24351559579372406,
        0.33085086941719055,
        0.3325556218624115,
        0.24806207418441772,
        0.27245596051216125,
        0.3791625201702118,
        -0.18243563175201416,
        0.16474340856075287,
        0.3586627244949341,
        0.36795666813850403,
        0.4345801770687103,
        0.3105188310146332,
        0.3762281537055969,
        0.27001091837882996,
        0.22995401918888092
      ],
      [
        -0.04161572456359863,
        -0.10802613198757172,
        -0.1881561130285263,
        0.08998717367649078,
        0.12087120115756989,
        -0.08484382927417755,
        -0.07683148235082626,
        -0.17597372829914093,
        0.0674121230840683,
        0.07594756782054901,
        -0.07162671536207199,
        -0.10905063897371292,
        0.017237678170204163,
        0.09807558357715607,
        -0.06376214325428009,
        -0.1627136766910553,
        -0.08721891790628433,
        -0.1319022923707962,
        -0.18209370970726013,
        -0.12545627355575562,
        0.06509636342525482,
        -0.17071862518787384,
        0.05924704670906067,
        0.021075129508972168,
        -0.09705773741006851,
        0.11003811657428741,
        0.0091400146484375,
        0.049512624740600586
      ],
      [
        0.26974236965179443,
        0.3882746994495392,
        0.3908378481864929,
        0.4671750068664551,
        0.3569674789905548,
        0.414072185754776,
        0.19899113476276398,
        0.19956883788108826,
        0.35245752334594727,
        0.4933958053588867,
        0.5822318196296692,
        0.5477256178855896,
        0.4773128032684326,
        0.20318637788295746,
        0.2865505814552307,
        0.21064846217632294,
        0.519076406955719,
        0.4931901693344116,
        0.33626657724380493,
        0.0006128251552581787,
        -0.04944925010204315,
        0.11460275948047638,
        0.3844868540763855,
        0.5142375826835632,
        0.252209335565567,
        0.4493922293186188,
        0.32746320962905884,
        0.18599531054496765
      ],
      [
        0.3285154700279236,
        0.3297000527381897,
        0.551375150680542,
        0.4715607762336731,
        0.2271830141544342,
        0.30499041080474854,
        0.2081841081380844,
        0.1394580602645874,
        0.6348262429237366,
        0.39129891991615295,
        0.5803911685943604,
        0.4646272361278534,
        0.21843740344047546,
        0.21138887107372284,
        0.4851663410663605,
        0.3200378715991974,
        0.5243999361991882,
        0.31561973690986633,
        0.2881803512573242,
        -0.08144649863243103,
        0.009367302060127258,
        0.4078820049762726,
        0.2548566460609436,
        0.5209991931915283,
        0.5803729891777039,
        0.3221960663795471,
        0.4148584008216858,
        0.4278706908226013
      ],
      [
        -0.05690629035234451,
        0.10886257141828537,
        0.11413025856018066,
        0.029115546494722366,
        0.03302254527807236,
        -0.22000721096992493,
        0.052633024752140045,
        0.1469925194978714,
        0.05435499548912048,
        -0.03817283734679222,
        0.020000122487545013,
        0.08058153092861176,
        0.10034360736608505,
        -0.041995249688625336,
        -0.017684485763311386,
        -0.03389017656445503,
        0.0005783442175015807,
        0.08121946454048157,
        -0.08309997618198395,
        0.13039274513721466,
        0.16298483312129974,
        0.18076938390731812,
        0.08871718496084213,
        -0.006192276254296303,
        -0.1327749490737915,
        -0.03911217674612999,
        -0.16601848602294922,
        0.05427386239171028
      ],
      [
        -0.010714113712310791,
        -0.1830805093050003,
        -0.03063655085861683,
        -0.10035931318998337,
        0.050583746284246445,
        -0.19571812450885773,
        -0.0908380001783371,
        -0.15108874440193176,
        -0.09644041210412979,
        -0.1418154537677765,
        0.14283576607704163,
        -0.16033346951007843,
        -0.15559887886047363,
        0.10322318971157074,
        -0.017678502947092056,
        -0.031934283673763275,
        0.028636232018470764,
        -0.0867454782128334,
        -0.03918997943401337,
        -0.1737387478351593,
        -0.16618208587169647,
        -0.08179304748773575,
        0.18237756192684174,
        0.16774706542491913,
        -0.026809964329004288,
        -0.19364485144615173,
        -0.0617474764585495,
        -0.050380825996398926
      ],
      [
        0.3470202684402466,
        0.38714227080345154,
        0.28099125623703003,
        0.3634997308254242,
        0.4786240756511688,
        0.24186427891254425,
        0.20995190739631653,
        0.30373188853263855,
        0.5945208072662354,
        0.5686271786689758,
        0.2749007046222687,
        0.48180297017097473,
        0.34638118743896484,
        0.47561612725257874,
        0.48648369312286377,
        0.46275565028190613,
        0.2859218418598175,
        0.5313000082969666,
        0.185703843832016,
        -0.12543858587741852,
        0.14042918384075165,
        0.3530525863170624,
        0.1588926464319229,
        0.4908742308616638,
        0.2613544166088104,
        0.540175199508667,
        0.4941485524177551,
        0.3582477569580078
      ],
      [
        0.29932543635368347,
        0.5632340312004089,
        0.4758372902870178,
        0.49902546405792236,
        0.28900131583213806,
        0.3459605872631073,
        0.20862041413784027,
        0.3705168664455414,
        0.6152302622795105,
        0.4699710011482239,
        0.5785186886787415,
        0.5908291339874268,
        0.3360477685928345,
        0.2938222885131836,
        0.3957917392253876,
        0.2319905012845993,
        0.2128158062696457,
        0.47765234112739563,
        0.20663438737392426,
        0.05087308585643768,
        -0.07198917120695114,
        0.17289187014102936,
        0.25357648730278015,
        0.5455453991889954,
        0.33192676305770874,
        0.2221084088087082,
        0.5001980662345886,
        0.3336181938648224
      ],
      [
        0.5852718353271484,
        0.4996710419654846,
        0.3730764091014862,
        0.5994603633880615,
        0.4596400856971741,
        0.32674264907836914,
        0.44386693835258484,
        0.3697892725467682,
        0.6431770324707031,
        0.52289217710495,
        0.6077761054039001,
        0.6559575796127319,
        0.309213250875473,
        0.23042795062065125,
        0.35078704357147217,
        0.4994874596595764,
        0.18863575160503387,
        0.47965168952941895,
        0.47272560000419617,
        -0.049389004707336426,
        -0.1755472868680954,
        0.27130889892578125,
        0.36017170548439026,
        0.1499088853597641,
        0.4314516484737396,
        0.30050960183143616,
        0.3171207904815674,
        0.41467952728271484
      ],
      [